category,question ,answer,bonus,final_trivia,double_jeopardy
Not So Common Sense,With what is charcoal and saltpeter mixed to make gunpowder?,Sulfur,,,
Not So Common Sense,What color is produced by the complete absorption of light rays?,Black,,,
Not So Common Sense,"What is the common name for iron oxide, which appears after iron has been exposed to air and water?",Rust,,,
Not So Common Sense,What is the only metal that is liquid at room temperature?,Mercury,,,
Not So Common Sense,What word describes the amount of light allowed to pass through a camera lens?,Aperature,,,
Not So Common Sense,"Triton, first discovered on October 10, 1846, by English astronomer William Lassell, is the largest moon orbiting what planet? It is the only large moon in the Solar System with a retrograde orbit, an orbit in the direction opposite to its planet's rotation.",Neptune,TRUE,,
Geography,"At 8,891 kilometers (5,525 miles), what border, which sees over 100 million crossings per year, is the world's longest shared international boundary? The border includes 119 bridges, 13 ferry crossings, 39 railroad crossings, and 6 unstaffed road crossings.",US-CANADA,,TRUE,
Technology,"What game, whose first version was released on June 6, 1984 while its designer was working for the Dorodnitsyn Computing Centre of the Academy of Science of the Soviet Union, has shipped 170 million units making it the best-selling game of all time?",Tetris,,TRUE,
"History,Art & Literature","The Bhagavad Gita, a 700-verse scripture, is part of what Hindu epic of 200,000 verses that tells the story of the Kurukshetra War and the fates of the Kaurava and the Pāṇḍava princes? It is the longest epic poem known at nearly 10x the ""Illiad"" and ""Odyssey"" combined.",Mahabharata,,TRUE,
History,What is the best-known invention of Nobel Prize founder Alfred Nobel?,Dynamite,,,
History,What was the first country to use a public monorail system? (1821),United Kingdom ,,,
"History,Presidents",Which U.S. President signed the National Aeronautics and Space Act establishing NASA?,Dwight D. Eisenhower,,,
History,"In 1975, what modern marvel re-opened after an 8 year closure?",Suez Canal,,,
History,Which country saw the Mau Mau Uprising from 1952-1960?,Kenya,,,
History,Who was the director of the FBI from 1924 to 1972?,J. Edgar Hoover,,,
History,Where was Ben Franklin born?,"Boston, Massachusetts",,,
"History,Presidents",What was the name of Franklin Roosevelt's longtime supposed mistress?,Lucy Mercer,TRUE,,
Food & Beverage,What is considered the queen of fruits?,Mango,,,
Food & Beverage,What is the name for a gin martini garnished with a pickled onion instead of an olive?,Gibson,,,
Food & Beverage,"According to Pliny the Elder, we get the word Salary from Roman practice of paying soldiers in what?",Salt,,,
Food & Beverage,The most traditional Greek feta cheese is made from what animal's milk?,Sheep,,,
Food & Beverage,What is champagne substitute is used to turn a “Black Velvet” cocktail into a “Poor Man’s Black Velvet” cocktail?,Cider,,,
Food & Beverage,"What type of food is ""Limburger""?",cheese,,,
Food & Beverage,What fruits are fermented to make Perry?,Pears,,,
Food & Beverage,"In a Cortado or cappucino, what is the main purpose of the milk?",reduce acidity of coffee,TRUE,,
Not So Common Sense,What is another name for the Spring Solstice?,Vernal Equinox,,,
Not So Common Sense,Which real life person took a name meaning Man of Steel?,Joseph Stalin,,,
"Not So Common Sense,Presidents",Who was US President Ronald Reagan's first wife?,Jane Wyman,,,
Not So Common Sense,From what animal do we get fleece?,Sheep,,,
Not So Common Sense,Which word in computing is used to describe half of a byte?,Nibble,,,
Not So Common Sense,What is the name for the type of scissors which produce a zig-zag cut when cutting fabric?,Pinking shears,,,
Not So Common Sense,James Hunt was disqualified after winning which 1976 Grand Prix?,British,,,
Not So Common Sense,What are the names of a one and two humped camel respectively?,"Dromedary Camel, Bactrian Camel",TRUE,,
Science,"In the Standard Model of Elementary Particles, one of the major classes of sub-atomic particles are fermions, which include quarks and their various flavors, as well as what other particle type which includes electrons, muons, taus, and various types of neutrinos?",Leptons,,TRUE,
"History,Presidents","Following the resignation of President Juan Isidro Jimenes Pereyra in 1916, what nearby nation did Woodrow Wilson order marines to occupy in order to maintain stability? The U.S. government's rule ended in October 1922 and elections were held in March 1924.",Dominican Republic,,TRUE,
"Biology,Medicine","What fruit, native to Asia and long used in traditional Asian cuisine, is the fruit of either Lycium barbarum or Lycium chinense, two closely related species of boxthorn in the nightshade family? Since about 2000, it has become common in the West as an alternative medicine and superfood.",Gogi Berry,,TRUE,
History,Who was the famous teacher of Socrates?,Plato,,,
History,In what year was the Hubble telescope launched into orbit?,1990,,,
History,"What company, founded in 1885, is the oldest telecommunications company in the US?",AT&T,,,
History,What was the name of the plane that dropped the atomic bomb on Hiroshima?,Enola Gay,,,
History,What Shakespearean king was actually king of Scotland for 17 years in the 11th Century?,Macbeth,,,
History,"What wiped out Napoleon's Caribbean troops, leading him to scrap plans to conquer the New World?",Yellow Fever,,,
History,Which two public figures were assassinated in the United States in 1968?,"MLK, Robert Kennedy",,,TRUE
History,"What was the Allie's code name for the ""D-Day"" invasion of Normandy?",Operation Overlord,TRUE,,
Food & Beverage,What nuts are used to make a Satay sauce - primarily used in asian cuisine?,Peanuts,,,
Food & Beverage,What is an Affogato?,Ice cream + Espresso,,,
Food & Beverage,What is the name of the cup used by Christ at the last supper?,The Holy Grail,,,
Food & Beverage,"Which word, taken from the French, translates literally as ""rotten pot""?",Potpourri,,,
Food & Beverage,What country has the highest consumption of chocolate per capita?,Switzerland,,,
Food & Beverage,"How many milliliters is a teaspoon? 1mL, 5mL, 10mL",5 mL,,,
Food & Beverage,"What is the only bonus item, that dances around the maze, Ms. Pac-Man can eat that is not a type of fruit?",Pretzel,,,
Food & Beverage,"What does the word ""sushi"" literally translate to?",Rice - Sashimi is raw fish,TRUE,,
Not So Common Sense,"Which Latin word is used to express the meaning ""word for word""?",Verbatim,,,
Not So Common Sense,What type of shop did the Wright Brothers own before devoting their time to flight?,Bike Shop,,,
Not So Common Sense,What is the cap on the fire hydrant called?,bonnet,,,
Not So Common Sense,How many rings are there on a five-zone archery target?,Four,,,
Not So Common Sense,Which two fruits are an anagram of each other?,Lemon and Melon,,,TRUE
Not So Common Sense,What is the name for Argentinean cowboys?,Gauchos,,,
Not So Common Sense,What 3 word phrase is written on Martin Luther King's gravestone?,Free at Last,,,
Not So Common Sense,What are the three yellow properties on the standards Monopoly board?,"Marvin Gardens, Atlantic Ave., Venitor Ave.",TRUE,,
Geography,"Lake Titicaca, the highest commercially navigable lake in the world and the largest lake in South America, can be found on the border of which two nations? It is located in the Cordillera Central along with some of the highest spots in the Americas.",Peru and Bolivia,,TRUE,
History,"What British ruler, King of Wessex from 871 to 886, won a decisive victory in the Battle of Edington in 878? His rule as King of the Anglo-Saxons from circa 886 through his death in 899 represents the start of the first unbroken line of kings to rule the whole of England.",Alfred the Great,,TRUE,
Art & Literature,"What influential author of African-American literature and central figure of the Harlem Renaissance, whose most well-known work is the 1937 novel ""Their Eyes Were Watching God"", was also an anthropologist who published research on Haitian voodoo?",Zora Neale Hurston,,TRUE,
History,Which amendment to the US Constitution deals with Searches and seizures?,4th,,,
"History,Presidents",Who was the first US President to be on a coin?,Lincoln,,,
History,"In 2005, Bhutan became the first country to entirely ban what?",tobacco,,,
"History,Presidents",What farm animal did George Washington introduce to the US?,"The Mule (M donkey, F Horse)",,,
History,The Battle of Bunker Hill occurred during what war?,American Revolutionary,,,
"History,Presidents",Who was the first Boy Scout to become a US president?,JFK,,,
History,How was the country of Belize known prior to 1973?,British Honduras,,,
History,"When their terms are summed, which of the following Presidential pairs served the longest: Andrew Johnson & Lyndon Johnson, William Henry Harrison & Benjamin Harrison, John Adams & John Quincy Adams, George H. W. Bush & George W. Bush?",Bushes,TRUE,,
Food & Beverage,"Introduced in 1892 by wholesale grocer Joel Owsley Cheek, and named for a now-defunct Hotel in Nashville, Tennessee (its first major customer), what American brand uses the registered trademark ""Good to the last drop.""?",Maxwell House,,,
Food & Beverage,The Queensland nut is another name for what nut?,Macadamia Nut,,,
Food & Beverage,In the game Ms. Pac-Man eating what fruit was worth 5000 points?,Banana,,,
Food & Beverage,"In Japanese, what kind of common fish is ""maguro""?",Tuna,,,
Food & Beverage,What spice is often considered as the most expensive one by weight?,Saffron,,,
Food & Beverage,Eclairs are said to have originated in which country?,France,,,
Food & Beverage,What are the two fruit juices in a cosmopolitan?,Cranberry and Lime,,,TRUE
Food & Beverage,The cobnut is the fruit of what tree?,Hazel,TRUE,,
Not So Common Sense,What element is combined with iron to become steel?,carbon,,,
Not So Common Sense,What is the only breed of cat that does not have retractable claws?,Cheetah,,,
Not So Common Sense,"What creates cirques, coombs, and corries?",glaciers,,,
Not So Common Sense,What does FM stand for?,Frequency Modulation,,,
Not So Common Sense,What is Nitrous Oxide more commonly known as?,Laughing Gas,,,
Not So Common Sense,What birds are traditionally used as gas detectors in coal mines?,Canaries,,,
Not So Common Sense,"What number is indicated by the Roman numeral ""D""?",500,,,
Not So Common Sense,What does uranium become when it has lost all of its radioactivity?,Lead,TRUE,,
Technology,"What type of digital display, found in phones, gaming consoles, and television screens, is an emissive electroluminescent layer of an organic compound that emits light in response to an electric current and works without a backlight? Apple introduced this tech to their lineup in the iPhone X.",organic light-emitting diode (OLED),,TRUE,
History,"What French mathematician, who is given credit for early developments that led to infinitesimal calculus, scribbled a note in the margin of his copy of ""Arithmetica"" regarding a problem he could prove, but which would not fit within the space of the margin? last theorem - pathagoreom therom - hardest proof in math history (good will hunting)",Fermat,,TRUE,
Art & Literature,"What novel, published as a serial in 1849–50, follows events in Charles Dickens' own life and is often considered a veiled autobiography? In the preface to the 1867 edition, Dickens referred to himself as a ""fond parent"" and the novel as his ""favourite child"".",David Copperfield,,TRUE,
History,The original Legoland opened in which country in 1968?,Denmark,,,
History,What was astronaut Edwin Eugene Aldrin Jr.'s nickname?,Buzz,,,
History,In which decade was the Rubik's Cube invented?,1970s,,,
History,In 1938 _______and his team finished the design of the VW Beetle.,Ferdinand Porsche,,,
History,What was the real last name of American folk hero Johnny Appleseed?,Chapman,,,
History,"In 1930, Jacob Schick received a patent for what hygenic invention?",First Electric Razor,,,
History,"The F-35 Lightning II, a family of single-seat, single-engined, all-weather stealth fighter jets was used for the first time in combat last year and has a projected service life through 2070. What company makes the F-35?",Lockhead Martin,,,
History,"When visiting Las Vegas, you fly into the McCarran International Airport and likely spend most of your time on the Strip, not in Las Vegas but in what unincorporated Nevada town adjacent to the city of Las Vegas?",Paradise,TRUE,,
Food & Beverage,"What company originally owned the name ""Saltine"" before losing it to trademark dilution?",Nabisco,,,
Food & Beverage,Pretzel and potato chip company Snyder's is based out of what Pennsylvania city?,Hanover,,,
Food & Beverage,"What bread's name may come from German words meaning ""devil's fart""?",Pumpernickel,,,
Food & Beverage,"What ""mocktail"" can be mixed from cranberry and grapefruit juice and peach nectar?",Safe sex on the beach,,,
Food & Beverage,What type of food is Fontina?,Cheese,,,
Food & Beverage,What continent does yerba mate originate from?,South America,,,
Food & Beverage,"What do you get when you mix white rum, lime juice, mint and sugar?",Mojito,,,
Food & Beverage,What restaurant chain was the brainchild of Atari founder Nolan Bushnell?,Chuck E Cheeses,TRUE,,
Not So Common Sense,How many tiles does each player pick at the start of a game of Scrabble?,7,,,
Not So Common Sense,In 1953 GM first introduced what iconic sports car?,Corvette,,,
Not So Common Sense,What is a Funambulist?,tight rope walker,,,
Not So Common Sense,How many white stripes are there on the American flag?,6,,,
Not So Common Sense,What is know as a brickfielder?,Hot and dry Southern Australian wind,,,
Not So Common Sense,What is a travelator?,Horizontal escaltor,,,
Not So Common Sense,"What Mexican city with a population of nearly 1 million, located along the US border in the Imperial Valley, is the capital of Baja California and, while still largely agriculture, has become a center of industry?",Mexicali,,,
Not So Common Sense,"What are the ""una corda"", ""sostenuto"", and ""damper""?",Pedals on a piano,TRUE,,
Technology,"What distributed document search and retrieval network protocol, developed in the early 1990s as a pre-cursor to modern search engines, may take its name from the mascot of University at which it was developed?",Gopher Protocol,,TRUE,
"Astronomy,Astrology","What large constellation, commonly represented as a man grasping the snake, is one of thirteen constellations that cross the ecliptic and has therefore been called the ""13th sign of the zodiac""?",Ophiuchus ((oaf-ih-YOU-kus)),,TRUE,
Art & Literature,"What English poet, who lived from 1572-1631, is perhaps best known for his 1609 fourteen-line poem (sonnet), often called Sonnet X from his collection of poems ""Holy Sonnets"", known by its opening words ""Death Be Not Proud""?",John Donne,,TRUE,
History,What christmas decoration was originally made from strands of silver?,Tinsel,,,
History,"In Charles Dickens’ “A Christmas Carol,” what was Mr. Scrooge’s first name?",Ebeneezer,,,
History,What is the highest grossing christmas film of all time?,Home Alone,,,
History,What traditional Christmas decoration is actually a parasitic plant?,Mistletoe,,,
History,"What Christmas-themed ballet premiered in Saint Petersburg, Russia in 1892?",The Nutcracker,,,
History,"According to the folklore of Germany and other countries, what horned figure punishes naughty children at Christmastime?",Krampus,,,
History,What holiday movie sequel includes a cameo by Donald Trump?,Home Alone 2,,,
History,"In the movie “A Christmas Story,” what was the name of the next door neighbors whose dogs ate the Christmas turkey?",The Bumpuses,TRUE,,
Food & Beverage,In which direction should you stir mincemeat for good luck; clockwise or anti-clockwise?,Clockwise,,,
"Food & Beverage,Christmas","What name is given to small sausages wrapped in bacon, a staple at a British Christmas dinner?",Pigs in a blanket,,,
"Food & Beverage,Christmas",What christmas beverage is also known as milkpunch?,Eggnog,,,
"Food & Beverage,Christmas",What is the most popular meal for Christmas in Japan?,KFC,,,
"Food & Beverage,Christmas",What much-reviled Christmas edible is known for its long shelf life?,Fuitcake,,,
"Food & Beverage,Christmas",The red and white costume of Father Christmas was allegedly first introduced by which drinks manufacturer?,Coca-Cola,,,
"Food & Beverage,Christmas","According to legend, what holiday goodies were shaped to resemble a shepherd’s staff, as a way to remind children of the shepherds who visited baby Jesus?",Candy Canes,,,
Food & Beverage,If you take a vacation to the tropics you may find yourself drinking a nice glass of POG by the beach. The O and the G stand for orange and guava. What does the P in POG stand for?,Passion Fruit,TRUE,,
Not So Common Sense,In what month is the Earth closet to the sun?,January,,,
"Not So Common Sense,Christmas","The French word “Noel” is often used around Christmas, but what was its original meaning in Latin?",Birth,,,
"Not So Common Sense,Christmas",In Frosty the Snowman what made him come to life?,Old silk hat,,,
"Not So Common Sense,Christmas",In what country did the custom of putting up a Christmas tree originate?,Germany,,,
"Not So Common Sense,Christmas",Who invented electric Christmas lights?,Thomas Edison,,,
"Not So Common Sense,Christmas",Which of Santa’s reindeer is named after another animal?,Vixen (fox),,,
Not So Common Sense,How many wise men / Magi / kings does the bible say visited the baby Jesus?,None - 3 gifts so we assume,,,
"Not So Common Sense,Christmas",Name Santas 9 reindeer,"Blitzen, Comet, Cupid, Dasher, Prancer, Vixen, Dancer, and Donner, Rudolph",TRUE,,
Language,"What nation sees nearly 8 million people, roughly 25% of its population, speak the indigenous language Quechua? Derived from the main language of the Incan empire, it is the most widely spoken language family of indigenous peoples of the Americas.",Peru,,TRUE,
Geography,"The oceanic pole of inaccessibility is the place in the ocean that is farthest from land. Located in the South Pacific 1,670 miles from the nearest island, what is the name for this point? It is Latin for ""no one"".",Nemo,,TRUE,
"Art & Literature,Harry Potter","The students at Hogwarts are placed into four houses, Gryffindor, Slytherin, Ravenclaw, and Hufflepuff, represented respectively by a lion, a serpent, an eagle, and what other mascot for Hufflepuff?",Badger,,TRUE,
History,Who was the 13th President of the United States of America?,Millard Fillmore,,,
History,"What nation switched sides in World War II on September 8, 1943?",Italy,,,
History,In which country was the Rosetta Stone found?,Egypt,,,
History,How did Al Capone die?,Syphilis,,,
History,"Who was the first man to reach the South Pole on Dec. 14, 1911?",Roald Amundsen,,,
History,"In the first Punic War, Rome and Carthage fought over possession of what Mediterranean island?",Sicily,,,
History,The Declaration of Independence was adopted in the east wing of what building?,Independence Hall,,,
History,"On October 7, 1985, what Italian cruise ship was hijacked by four men representing the Palestine Liberation Front off the coast of Egypt? The hijacking led to the Sigonella crisis and an armed standoff between US and Italian armed forces.",Achille Lauro Highjacking,TRUE,,
Food & Beverage,"What is the literal translation of the word ""tofu""?",Bean Curd,,,
Food & Beverage,What is the name of a wine barrel that contains 10 gallons of wine?,Anker,,,
Food & Beverage,"What brand of whiskey is made in Lynchburg, Tennessee?",Jack Daniels,,,
Food & Beverage,What two fruits can calvados be made from? Brandy from France,Pear/apples,,,
Food & Beverage,"According to popular wisdom, you should only eat oysters in months whose names contain which letter?",R,,,
Food & Beverage,"What is meant by the cooking term ""farci""?",Stuffed,,,
Food & Beverage,How many ounces is a jigger of alcohol?,1.5 ounces,,,
Food & Beverage,"What spiced wine is traditionally consumed during the winter months, and especially around Christmas?",Mulled Wine,TRUE,,
Not So Common Sense,Beijing Capital International Airport has been the second busiest airport in the world. What is the three letter IATA airport code for this airport? It is based on the city's former romanized name.,PEK,,,
Not So Common Sense,What is the first prime number that comes after 100?,101,,,
Not So Common Sense,What color does the bride commonly wear in China?,Red,,,
Not So Common Sense,"How many time zones are spanned by Russia? 7, 9, 11",11,,,
Not So Common Sense,Three gold balls are a universal symbol for what type of business?,Pawn Shop,,,
Not So Common Sense,What does the abbreviation HTML stand for?,HyperText Markup Language,,,
Not So Common Sense,"What Roman goddess of the hunt, the moon, and nature, associated with wild animals and woodlands, is also known as the virgin goddess of childbirth and women? She is the daughter of Jupiter and Latona, and the twin sister of Apollo.",Artemis,,,
Not So Common Sense,"Designed by Steve Jobs and Ronald Wayne in 1976, the original logo for Apple features what scientist and author who wrote ""Philosophiæ Naturalis Principia Mathematica"", first published in 1687?",Isaac Newton,TRUE,,
Geography,"By population, what county of nearly 2.7 million people is the most populous county in New York State and 8th most populous county in the United States? It is also the second densest county, and is among the fastest growing counties, in the country.",Brooklyn,,TRUE,
History,"Determine and rank the following in order of who was born first to who was born last; Genghus Khan, Alexander the Great, Julius Cesaer.","Alexander the Great (356-323BC), Julius Cesear (100-44BC), Ghengis Khan (1162-1227)",,TRUE,
Art & Literature,"""Ironweed"", the 1984 winner of the Pulitzer Prize for Fiction, is a 1983 novel by what American author whose works also include ""The Ink Truck"" (1969), ""Roscoe"" (2002) and ""Changó's Beads and Two-Tone Shoes"" (2011)?",William Kennedy,,TRUE,
History,In the 1960s Dr. Christiaan Barnard performed the first successful human _______transplant?,Heart,,,
History,Henry VIII was a member of what dynastic house of the English monarchy?,Tudor,,,
History,In which country was the Rosetta Stone found?,Egypt,,,
History,Who led the first expedition to sail around the world?,Ferdinand Magellen,,,
History,What famous European City is traditionally said to be built on 7 hills?,Rome,,,
History,Which state was the first to secede from The Union leading to the US civil war?,S. Carolina,,,
History,"What is the better-known name of the Island of Pelicans in SF Bay, which was home to California's first lighthouse?",Alcatraz,,,
History,Which two tools are depicted on the former Soviet Union's flag?,Hammer and Sickle,TRUE,,
Food & Beverage,The Shaddock is a variety of fruit from what fruit family? ,Citrus,,,
Food & Beverage,What garden vegetable was known for years as Italian squash?,Zucchini,,,
Food & Beverage,What kind of clay oven is used to make Indian dishes like naan and chicken tikka?,Tandoor,,,
Food & Beverage,What two ingredients make a Black Velvet cocktail?,Champagne and stout,,,
Food & Beverage,What is the name of a small barrel of beer of nine gallons capacity?,A Firkin,,,
Food & Beverage,What is the main ingredient in Borsch?,Beet Root,,,
Food & Beverage,What French Benedictine monk is credited with the invention of Champagne?,Dom Pérignon,,,
Not So Common Sense,"Where did the world's tallest bird, the giant moa, live until it went extinct around 1500?",New Zealand,,,
Not So Common Sense,How many colors were there in the first boxes of Crayola crayons sold in 1903,8,,,
Not So Common Sense,What is the front of a saddle called?,Pommel,,,
Not So Common Sense,What distance did the Romans once define as a thousand paces?,a mile ,,,
Not So Common Sense,The entrance to what New York City landmark has a pair of lion sculptures?,Public Library,,,
Not So Common Sense,"On a medical diploma, what does D.D.S. stand for?",Doctor of Dental Surgery,,,
Not So Common Sense,What is the more common name for an Apiarist?,Beekeeper,,,
Not So Common Sense,What is floating wreckage of a ship called?,Flotsam,TRUE,,
Geography,"What park, encompassing nearly 3.4 million acres between the Great Basin and Mojave deserts, is the largest national park in the lower 48 United States? It was established as a National Monument in 1933 and named a National Park in 1994.",Death Valley NP,,TRUE,
History,"In 1791, what military engineer, who served in the Continental Army during the American Revolutionary War, developed an urban plan for the city of Washington D.C.?",Pierre Charles L'Enfant,,TRUE,
Art & Literature,"""The Strange Case of Dr. Jekyll and Mr. Hyde"" is about a London lawyer named Gabriel John Utterson who investigates strange occurrences between his old friend and his multiple personalities. What are Dr. Jekyll and Mr. Hyde's first names?","Dr. Henry Jekyll, Mr. Edward Hyde",,TRUE,
History,"French Sudan was a French colonial territory in the federation of French West Africa from around 1880 until 1960, when it became what independent state? Today this country has nearly 20 million residents, a green, gold, and red flag, and its capital at Bamako.",Mali,,,
History,"What empire, which reached the height of its power during the 13th and 14th centuries, was the largest contiguous land empire in history?",Mongol Empire,,,
History,"Germany's World War I allies were Austria-Hungary, Bulgaria, and what other empire?",Ottoman Empire,,,
