category,question ,answer,bonus,final_trivia,double_jeopardy
History,"What company, founded in 1917 as Japan Optical Industries and a member of the Mitsubishi group, is known for its digital cameras and optical gear including its Coolpix line? It introduced its new full-frame mirrorless Z series cameras in late 2018.",Nikon,,,
History,What chapel do Cardinals congregate in to elect a new Pope?,Sistine Chapel,,,
History,What was the first product to have a barcode?,Wrigley's gum,,,
History,"What year did the famous Sears Tower in Chicago had its name changed to the ""Willis Tower""?",2009,,,
History,Citizens of what empire are credited with starting the tradition of gift giving?,Romans,,,
History,"Following the death of his first Vice President, George Clinton, who was the first President to serve part of his term without a VP? He was re-elected for a second term with Elbridge Gerry as his running mate.",James Madison,,,
History,"In which capital city was the crime fighting organisation ""Interpol"" founded in 1923?",Vienna,TRUE,,
Food & Beverage,What colour M&Ms did not exist from 1976 to 1987 due to health concerns regarding the dye?,Red,,,
Food & Beverage,What are the two primary ingredients that go into a Hollandaise sauce?,Butter and egg yolks,,,
Food & Beverage,What year did Frank's RedHot sauce first appear on the market?,1920,,,
Food & Beverage,Edam cheese (semi-hard cheese) originated in which country?,The Netherlands,,,
Food & Beverage,In 1930 what iconic Hostess desert was invented?,Twinkie,,,
Food & Beverage,What brand of seasoning was named after a famous prime rib restaurant?,Lawry's,,,
Food & Beverage,What is the technical name for the chef's hat?,Toque Blanche,,,
Food & Beverage,What did Nestle freeze dry in 1938 that led to the development of powdered food products?,Coffee,TRUE,,
Not So Common Sense,"What word means ""so be it"" in Hebrew?",Amen,,,
Not So Common Sense,What does the abbreviation CSS stand for?,Cascading Style Sheets,,,
Not So Common Sense,What letter is least used in the English language?,Z,,,
Not So Common Sense,What is the name of the kneeling cushions in churches?,Hassocks,,,
Not So Common Sense,"How many sheets of paper are there in a ream? 250, 500, 1000",500,,,
Not So Common Sense,What color is the one-ball in a traditional billiards set?,yellow,,,
Not So Common Sense,"What is the critical card to ""shoot the moon"" the game of Hearts?",Queen of Spades,,,
Not So Common Sense,"What chemical element, number 18 on the periodic table and the third most abundant gas in Earth's atmosphere at almost 1% (more than 20x as abundant as carbon dioxide), takes its name from a Greek word meaning ""lazy"" or ""inactive""? ",Argon,TRUE,,
Science,"What astronomical unit of length is defined as the distance from the Sun to another astronomical object that has a parallax angle of one arcsecond? The nearest star, Proxima Centauri, is roughly 1.3 units away, and most stars in the sky are within 500 units.
",Parsec,,TRUE,
Art & Literature,"""Arrangement in Grey and Black No.1"", one of the most famous works from an American artist, which was created in 1871 and currently hangs in the Louvre Abu Dhabi, was created by what Massachusetts born painter while he was living in London?",James McNeill Whistler,,TRUE,
Business,"What airline, formed in 1924, which purchased Pan Am's East coast and European routes in the 90s and merged with Northwest Airlines in 2008, and is based at the world's busiest airport, is the world's second largest carrier by both revenue and passengers?",Delta Air Lines,,TRUE,
History,"The US Midwest experienced a severe drought known as the Dust Bowl, during what decade?",1930s,,,
History,What Mexican general led the attack against the Alamo in 1836?,President General Antonio López de Santa Anna,,,
History,The United Nations replaced the League of Nations in what year?,1945,,,
History,"When it was first created in 1938, what was the minimum federal wage in the US?",25 cents/ hour - $1 day,,,
History,"The unidentified serial killer, Jack the Ripper, was active during what year, and what country in the late 1800's?","1888, London, England",,,TRUE
"History,Presidents",Who was the first US president to take the oath of office using a nickname?,Jimmy Carter,,,
"History,Sports",Who was the last tennis player to win a Grand Slam using a wooden racquet?,Bjorn Borg,,,
"History,Technology",Who co-­founded Microsoft with Bill Gates?,Paul Allen,TRUE,,
Food & Beverage,"""Double Your Pleasure, Double Your Fun"" was an ad slogan used by what product?",Wrigley's Doublemint gum,,,
Food & Beverage,What common lasagna ingredient is actually a by-product of mozzarella?,Ricotta,,,
Food & Beverage,What food is also known as the apple of love or the love apple?,The tomato,,,
Food & Beverage,What is traditionally the main fruit ingredient in Black Forest cake?,Black Cherries,,,
Food & Beverage,What is the dominant fruit flavoring in Southern Comfort?,Peach,,,
Food & Beverage,"In the restaurant industry, what number does the kitchen commonly assign to an item that they've run out of?",86,,,
Food & Beverage,What variety of beans is used to prepare Boston baked beans?,Navy Beans,,,
Food & Beverage,What are the two basic categories of Scotch Whiskey?,Malt and Grain,TRUE,,
Not So Common Sense,What word refers to minimum attendance necessary for US Congress to conduct business?,Quorum,,,
Not So Common Sense,How long is a fortnight?,14 days,,,
Not So Common Sense,"In fitness and nutrition, what does the acronym ""BMI"" stand for?",Body Mass Index,,,
Not So Common Sense,What is the term used for the science of growing an apple?,Pomology,,,
Not So Common Sense,What digit does not exist in Roman Numerals?,Zero,,,
Not So Common Sense,Which male vocal range is pitched between tenor and bass?,Baritone,,,
Not So Common Sense,"How many bones are there in the human body? 206, 211, 221",206,,,
Not So Common Sense,What are the warm winds that blow off the Rocky Mountains called?,Chinooks,TRUE,,
Art & Literature,"What Italian scholar and poet, the founder of Humanism, is often credited with initiating the 14th-century Renaissance with his rediscovery of Cicero's letters? His sonnets were admired and imitated throughout Europe during the Renaissance.
",Petrarch - Francesco Petrarca,,TRUE,
Geography,"The Gravina Island Bridge, a boondoggle referred to as the ""Bridge to Nowhere"", was to link Gravina Island, its International Airport, and 50 residents with the town of Ketchikan at a cost of nearly $400 million. In what state was this bridge proposed to be built?",Alaska,,TRUE,
History,"What battle, fought between July 1st and November 18th of 1916 by the armies of the British Empire and French Third Republic against the German Empire, and named for a river in France, was the largest battle of the First World War on the Western Front?",Battle of the Somme,,TRUE,
History,What is the nationality of the first woman in space?,Soviet/Russian - Valentina Tereshkova,,,
History,At which famous American battle was General Custer defeated by Sitting Bull in June 1876?,Little Bighorn,,,
History,How many days were there in the ancient Egyptian year?,365,,,
History,"How long did the American Revolutionary War last? 8, 10, 12",8 years,,,
History,Herodotus is commonly referred to as the father of what?,History,,,
History,What were the two world leaders in power when France sold the US The Louisiana Purchase in 1803 for $15 Million Dollars?,"Jefferson, Napolean",,,TRUE
History,What was Alaska called before 1867?,Russian America,,,
History,"What Greek physician is known as ""The Father of Medicine""?",Hippocrates,TRUE,,
Food & Beverage,What flavor is Grand Marnier?,Orange,,,
Food & Beverage,The first Starbucks outside of North America was opened in what country?,Japan,,,
Food & Beverage,What is the common name for coagulated soy milk curd pressed into blocks?,tofu,,,
Food & Beverage,What company makes Reese's Peanut Butter Cups?,Hershey's Company,,,
Food & Beverage,Which country did bagels originate from?,Poland,,,
Food & Beverage,What fruit comes in Hass and Florida variety?,Avocado,,,
Food & Beverage,Where does the ghost pepper originate?,Bangladesh,,,
Food & Beverage,"At resturants, what is the most ordered food in AMerica?",Fried Chicken,TRUE,,
Not So Common Sense,What was the Leaning Tower of Pisa originally used as?,Bell tower,,,
Not So Common Sense,"What relative does a Russian call ""babushka""?",Grandmother,,,
Not So Common Sense,What holds the bit in a drill?,Chuck,,,
"Not So Common Sense,Biology","Found in Red Blood cells, what is the oxygen carrying protein?",Hemoglobin,,,
Not So Common Sense,"""Pips"" is the correct term for the dots on what game pieces?",Dominoes,,,
Not So Common Sense,What is the name given for a two-hulled boat?,Catamaran,,,
Not So Common Sense,What English Earl's name is now associated with a type of sweater?,Earl of Cardigan ,,,
"Not So Common Sense,Sports",What is Tiger Woods' real first name?,Eldrick Tont Woods,TRUE,,
Technology,"What technology company, founded in 1891 and based in Amsterdam, Netherlands, developed the cassette tape in 1962 and followed that by developing the compact disc, along with Sony, in 1982? It is currently the world's largest lighting manufacturer.
",Philips,,TRUE,
Geography,"According to estimates by the Brookings Institution, Pricewaterhouse Cooper, and McKinsey, what city, first founded as a fishing village in the late twelfth century, has the largest GDP in the Eastern Hemisphere? It also has the largest in the world.","Toyko - The city's GDP estimates range from $1.48-2 trillion, giving it a small edge over New York City in all estimates. there is a large gap to city #3 which differs between estimates. London and Los Angeles are in the top five of all three, along with either Seoul, Paris, or Chicago.",,TRUE,
Art & Literature,"Horatio Hornblower, a Naval officer during the Napoleonic Wars and protagonist of a 12-book series, including ""A Ship of the Line"" and ""Flying Colours"", was created by what English novelist who also wrote ""The African Queen"", the basis for the 1951 film?",C.S. Forester,,TRUE,
History,What year was the social giant Facebook founded?,2004,,,
History,In what year was Wikipedia officially launched?,2001,,,
History,Montezuma was the emperor of which ancient society?,Aztecs,,,
History,"In 1983, the first Disney theme park built outside the US opened in what country?",Japan,,,
History,What is the oldest continuously inhabited city in the world?,Damascus,,,
History,"What are the four permanent, non-US members of the United Nations Security Council?","China, Russia, UK, France",,,
History,"What country's transcontinental railway was finally finished on November 7, 1885?",Canada - usa 1969,,,
History,"Before being hanged, whose last words were ""I only regret that I have but one life to lose for my country""?",Nathan Hale -USA Spy,TRUE,,
Food & Beverage,"The meat pie, Tourtiere, originated in which country?",Canada,,,
Food & Beverage,What brand of whisky was created in 1939 Queen of England's visit to Canada?,Crown Royal,,,
Food & Beverage,What traditionally tops the meat in a shepherd's pie?,Mashed potatoes,,,
Food & Beverage,Sapporo beer was first brewed in which country?,Japan,,,
Food & Beverage,What animal has been called the “poor man’s cow”?,goat,,,
Food & Beverage,What type of alcohol is typically used to make a mint julep?,"Bourbon - bourbon, sugar, water, crushed or shaved ice, and fresh mint",,,
Food & Beverage,"What is the only pasta to eat for good luck on New Years Day, according to Sicilian tradition?",Lasagna,,,
Food & Beverage,What bulb vegetable is traditionally worn on Saint David's Day? Welsh - march 1,Leek,TRUE,,
Not So Common Sense,Which black widow spider sex is venomous to humans?,female,,,
Not So Common Sense,"""Absolute zero"" is equal to zero degrees on which temperature scale?",Kelvin,,,
Not So Common Sense,Which cluster of stars is also known as the Seven Sisters?,The Plaedies,,,
Not So Common Sense,"How many calories must you burn to lose one pound? 3000, 3500, 4000","3,500",,,
Not So Common Sense,What is the plastic piece at the end of a shoelace called?,Aglet,,,
Not So Common Sense,What is the common two word name for Yucca Brevifolia?,Joshua Tree,,,
Not So Common Sense,What is the fear of one's own fears known as?,Phobophobia,,,
Not So Common Sense,The tuxedo got its name from what?,A small town in new york - tuxedo park (tuxedo club),TRUE,,
History,"What accomplished anatomist, astronomer, and mathematician is one of the most highly acclaimed architects in English history and includes among his works 52 London churches rebuilt after the Great Fire in 1666 including St. Paul's Cathedral?",Christopher Wren,,TRUE,
Art & Literature,"What word, from the French for ""to untie"", originally derived from the Latin root for ""knot"", is defined as the final outcome of a literary work, or the outcome of a complex sequence of events? Conflicts are resolved, returning the characters to a state of normalcy.",denouement,,TRUE,
Science,"Blackbody radiation, also known as black hole evaporation, predicted to be released by black holes due to quantum effects near the event horizon, is more commonly known by what name in honor of the theoretical physicist who predicted its existence in 1974?",Hawking Radiation,,TRUE,
History,1885 was the year the first skyscraper was built in what US City?,Chicago,,,
History,Peter the Great is considered the founding father of what country?,Russia,,,
History,Who succeeded Tom Brokaw as anchor on NBC’s Nightly News in 2004?,Brian Williams,,,
History,What US state was first to legalize same-sex marriage?,Mass,,,
History,What were slaves called in ancient Sparta?,Helots,,,
History,"What Danish peninsula lent its name to the largest naval battle of World War I between the British Royal Navy and the Imperial German Navy with a total of over 250 ships and over 8,000 casualties?",Battle of Jutland,,,
History,"Formerly known as Standard Oil, what petroleum company merged with Exxon in 1999?",Mobil,,,
History,During WWII the German Army used the Fischer-Tropsch process to synthetically produce what?,Deisel Fuel,TRUE,,
Food & Beverage,What is the alternative name of green onions?,Scallions,,,
Food & Beverage,What country does the cappuccino originate from?,Italy,,,
Food & Beverage,What cut of beef comes from between the neck and the shoulder blade?,Chuck,,,
Food & Beverage,"According to Toucan Sam, what should you always follow to find Froot Loops?",your nose,,,
Food & Beverage,How many spices make up allspice?,One - Pimento,,,
Food & Beverage,What's the meat in McDonald's original recipe for Egg McMuffins?,Canadian Bacon,,,
Food & Beverage,What meat is a Wiener Schnitzel traditionally made from?,Veal - baby cow,,,
Food & Beverage,What American brewery merged with the Canadian brewery Molson in 2005 to become one of the largest in the world?,Coors,TRUE,,
Not So Common Sense,"In the card game Bridge, what is considered the highest of the four suits?",Spades,,,
Not So Common Sense,How long is one furlong?,"1/8th Mile, 220 yrds, 660 ft, 201 m",,,
Not So Common Sense,How many enemy planes must a pilot shoot down to be called an ace?,Five,,,
Not So Common Sense,What type of a tree killed Jackson Pollock after he crashed into it drunk driving in 1956 at age 44?,Oak,,,
Not So Common Sense,What is Pokemon and abrreviation for?,Pocket Monster,,,
"Not So Common Sense,Language",Which English word is a combination of the first 2 letters of the Greek alphabet?,Alphabet,,,
Not So Common Sense,What is a Murphy Bed?,Foldaway bed,,,
Not So Common Sense,Which commemorative US state quarter depicts salmon leaping in front of a mountain on its reverse side?,Washington,TRUE,,
History,"What is the name for the four laws enacted in 1798 which made it harder for immigrants to become citizens, allowed imprisonment of non-citizens deemed dangerous, and criminalized making false statements critical of the federal government? A revised version is still in effect today.",The Alien and Sedition acts,,TRUE,
Geography,"In 1974 the Danish environmental ministry created the world's largest national park, at nearly 375,000 square miles, with an area nearly 1.5x the size of Texas, in order to govern a portion of what region? The permanant population of the park is zero.",China,,TRUE,
Science,"To date the United States has sent nine missions to Mars, eight of which landed successfully, and four of which had rovers which explored the Martian surface. Achieving the feat on July 4, 1997, what was the first NASA rover to land on Mars?",Sojourner - temporarily inhabit,,TRUE,
History,In 1936 what Palace was destroyed by fire?,The Crystal Palace,,,
History,Who was the first Holy Roman Emperor?,Charlemagne,,,
History,"When first founded by Benjamin Franklin, what was the job of the ""bucket brigade""?",To Put out fires,,,
History,Molotov cocktails were first used by what country after the Soviets invaded it in 1939?,Finland,,,
History,What U.S. president signed the bill that began Medicaid benefits?,LBJ,,,
History,At what Ohio university were four students shot to death during a 1970 anti-war demonstration?,Kent State,,,
History,Who is credited with inventing the V-2 rocket for Nazi Germany and later the Saturn V rocket for the United States?,Wernher von Braun,,,
History,"What bridge, which started construction in 1896 as the East River Bridge with Leffert Buck as engineer and Henry Hornbostel as architect, was the second bridge to cross New York City's East River? It was completed in 1903.",Williamsburg bridge - 1st was brooklyn and then manhattan,TRUE,,
Food & Beverage,"What is the common name for the fruit known as ""Citrus grandis""?",Grapefruit,,,
Food & Beverage,"Shiitake, Enoki, Button, Porcini are all types of what?",Mushrooms,,,
Food & Beverage,"What American beer has been long promoted as the ""King of Beers""?",Budweiser,,,
Food & Beverage,What kind of fruit juice is used to mix a Polish Martini?,Apple Juice,,,
Food & Beverage,In which decade was Tupperware first introduced to the market? 1940s 1950s or 1960s,1940s,,,
Food & Beverage,What country produces Angostura Bitters?,Trinidad and Tobago,,,
Food & Beverage,Goitre is mostly caused by the lack of what element (mineral) in the diet?,Iodine,,,
Food & Beverage,"What is the name of the chemical reaction in cooking that results in browing of a food.  It is a non-enzymatic reaction between an amino acid and a reducing sugar, usually requiring the addition of heat.",Maillard Reaction,TRUE,,
Not So Common Sense,"What precious metal did alchemists call ""luna""?",Silver,,,
Not So Common Sense,What is the largest muscle in the human body?,Gluteus Maximus ,,,
Not So Common Sense,"What type of insect is a ""weevil""?",Beetle ,,,
Not So Common Sense,What subatomic particle determines isotope?,Neutron,,,
Not So Common Sense,What are the two different chamber types of the heart?,Atrium and Ventricle,,,TRUE
Not So Common Sense,"What inert gas gets trapped in the blood when a diver gets ""the bends""?",Nitrogen,,,
Not So Common Sense,"Amirillo, Texas is home to the US' only nuclear what?",assembly and disassembly site,,,
Not So Common Sense,When determining the value of a diamond what are 3 of the 4 C's used in the diamond grading process?,"Cut, Clarity, Color, Carat",TRUE,,
Chemistry,"What process, which was first coined by Marcellin Berthelot from the Greek roots for ""within"" and ""hot"", is one in which energy, typically heat, is required or absorbed from surroundings? Examples include dissolving salt in water or melting ice cubes.",Endothermic Process,,TRUE,
Geography,"The Three Gorges Dam, with 22.5 gigawatts of generation capacity, has more capacity than any other power plant in the world. It also reduces the potential for floods downstream. In what country will you find this hydroelectric power plant?",China,,TRUE,
Art & Literature,"""Apocalypse Now"" follows Captain Willard on his hunt for Colonel Kurtz during the Vietnam War. It is based on 1899's ""Heart of Darkness"", which also featured Kurtz, but had a different main character. Who was searching for Kurtz in the original work?",Charles Marlow,,TRUE,
History,Achilles' heel was the result of him being dipped from his ankle in what mythical river?,The Styx,,,
History,What newspaper was founded in 1889 by Charles H. Dow and Edward Jones and is now the 5th most circulated newspaper in the US?,Wall Street Journal,,,
History,What was the first living creature to go into orbit in November 1957?,a Dog,,,
History,"In 1848, what current US state was ceded to the US from Mexico?",California,,,
History,Which Beethoven symphony became associated with victory in WWII?,the 5th,,,
History,Who is generally regarded as the inventor of the internal combustion automobile with a reliable 2-stroke engine?,Karl Benz,,,
History,"In 2011 the Standard & Poor credit rating agency reduced the United States' debt rating from AAA to AA+. There are currently only two companies that have kept a AAA rating, meaning that their debt is considered safer than Treasury Bonds. Who are they?","Microsoft, Johnson and Johnson",,,TRUE
History,"According to legend, what medieval fortification located in North Cornwall and owned by Charles, Prince of Wales, has a long association with legends related to King Arthur and has been considered his birthplace since the 12th century?",Tintagel Castle,TRUE,,
Food & Beverage,"A Kamikaze cocktail contains triple sec, lime juice and what?",Vodka,,,
Food & Beverage,What type of berry was once believed to cause birthmarks when eaten by pregnant women?,Strawberry,,,
Food & Beverage,Approximately how much more beer would you get in a pint served in the UK compared to one served in the US?,100ml - 1/2 cup - 3.4 oz,,,
Food & Beverage,What is the pure spirit distilled from wine?,Brandy,,,
Food & Beverage,Hawaii is the only US state to grow what?,Pinapples,,,
Food & Beverage,What is the largest cultivated crop in the United States?,Corn,,,
Food & Beverage,Irish coffee is made with what type of alcohol?,Whiskey,,,
Food & Beverage,"What is the name given to the dish of dates, or prunes, wrapped in bacon?",Devils on Horseback,TRUE,,
Not So Common Sense,What is non-rhyming poetry called?,Blank Verse,,,
Not So Common Sense,"According to the novel, Who was marooned on his remote island for 27 years? (Friday)",Robinson Crusoe,,,
Not So Common Sense,Kandor is the former capital city of what fictional planet?,Krypton,,,
Not So Common Sense,What was the name of Sherlock Holmes' intelligent brother?,Mycroft Holmes,,,
Not So Common Sense,"In 1939 classic ""The Wizard of Oz"", what was the lion in search of?",Courage,,,
Not So Common Sense,Juventas was the Roman goddess of what?,Youth,,,
Not So Common Sense,"Who was awarded the 2016 Nobel Prize for Literature ""for having created new poetic expressions within the great American song tradition.""?",Bob Dylan,,,
Not So Common Sense,"What famous composer composed the ""Brandenburg Concertos""?",Bach,TRUE,,
Biology,"The taxonomic order Lagomorpha, whose members have four incisors in their upper jaw and are almost strictly herbivorous, are made up of what animals, one of the top ten pets in the United States according to the American Veterinary Medical Association?",Rabbits and Hares,,TRUE,
Geography,"The Pan-American highway extends from the southern tip of South America to Prudhoe Bay, Alaska. It can be driven end-to-end except for a ~60-mile section which was never completed. What is the name of the uncompleted section?",The Darien Gap,,TRUE,
History,"What is the common name for the military organization, powerful during the Middle Ages, officially named ""Poor Fellow-Soldiers of Christ and of the Temple of Solomon""? They were founded in 1119, recognized by a papal bull in 1139, and active until 1312.",Kinghts Templar,,TRUE,
History,The USS Arizona Memorial commemorates the victims of what event?,Pearl Harbor,,,
History,Who was the first British monarch to live in Buckingham Palace?,Queen Victoria,,,
History,"Used to complete the first transcontinental railway, the last spike was made of what material?",Gold,,,
History,"Which historic figure is famous for having said, ""Give Me Liberty or Give Me Death""?",Patrick Henry,,,
History,The image of Uncle Sam was first used during what war?,War of 1812,,,
History,What ship was commanded by William Bligh?  The ship was eventually commandeered my mutineers.,HMS Bounty,,,
"History,Presidents","What 2 US Presidents both died on July 4th, 1826?","Jefferson, John Adams",,,TRUE
"History,Presidents",What was U.S. President Wilson's first name?,Thomas (woodrow is middle name),TRUE,,
Food & Beverage,What is the name for the family of plants including the peanut and soybean?,legume,,,
Food & Beverage,"What tart fruit has a sweet variety called ""Meyer""?",Lemon,,,
Food & Beverage,What fruit is a hybrid of the mandarin orange and the grapefruit?,Tangelo,,,
Food & Beverage,"What vegetable gets its name from the Latin word for ""branch""?",Broccoli,,,
Food & Beverage,What fruit comes in Chubby Gray and Jubilee variety?,Watermelon,,,
Food & Beverage,"What type of food is ""Limburger""?",cheese,,,
Food & Beverage,How is a Long black different from an Americano?,"The espresso is poured on top of the hot water, instead of before",,,
Food & Beverage,"Limburger, which is known for its especially strong smell, originated from what modern country?","Germany, Belgium, Netherlands - Liege Province",TRUE,,
Not So Common Sense,What is measured in Amperes?,Electric Current,,,
Not So Common Sense,What was the name given to the space missions that took place between the Mercury and Apollo missions?,Gemini,,,
